{
 "formatVersion": "1.0",
 "songId": "rocks-off",
 "title": "Rocks Off",
 "artist": "Sky Silver",
 "audio": {
  "file": "rocks-off_game.m4a",
  "altFiles": [
   "rocks-off_game.wav"
  ],
  "durationMs": 79419,
  "sampleRate": 48000,
  "sha256": "bb5984a819d678ae08b2f6eff11c2a170b99b265f3eb5c7642baa3df877cd519",
  "loudnessLufs": -13.9,
  "truePeakDbtp": -5.3,
  "previewStartMs": 61935,
  "sourceEdit": {
   "masterFile": "RocksOff.wav",
   "masterStartMs": 136929,
   "masterEndMs": 214348,
   "fadeInMs": 30,
   "fadeOutMs": 2000
  }
 },
 "timing": {
  "bpm": 124.0,
  "offsetMs": 0.0,
  "beatsPerBar": 4,
  "beats": [
   0,
   484,
   968,
   1452,
   1935,
   2419,
   2903,
   3387,
   3871,
   4355,
   4839,
   5323,
   5806,
   6290,
   6774,
   7258,
   7742,
   8226,
   8710,
   9194,
   9677,
   10161,
   10645,
   11129,
   11613,
   12097,
   12581,
   13065,
   13548,
   14032,
   14516,
   15000,
   15484,
   15968,
   16452,
   16935,
   17419,
   17903,
   18387,
   18871,
   19355,
   19839,
   20323,
   20806,
   21290,
   21774,
   22258,
   22742,
   23226,
   23710,
   24194,
   24677,
   25161,
   25645,
   26129,
   26613,
   27097,
   27581,
   28065,
   28548,
   29032,
   29516,
   30000,
   30484,
   30968,
   31452,
   31935,
   32419,
   32903,
   33387,
   33871,
   34355,
   34839,
   35323,
   35806,
   36290,
   36774,
   37258,
   37742,
   38226,
   38710,
   39194,
   39677,
   40161,
   40645,
   41129,
   41613,
   42097,
   42581,
   43065,
   43548,
   44032,
   44516,
   45000,
   45484,
   45968,
   46452,
   46935,
   47419,
   47903,
   48387,
   48871,
   49355,
   49839,
   50323,
   50806,
   51290,
   51774,
   52258,
   52742,
   53226,
   53710,
   54194,
   54677,
   55161,
   55645,
   56129,
   56613,
   57097,
   57581,
   58065,
   58548,
   59032,
   59516,
   60000,
   60484,
   60968,
   61452,
   61935,
   62419,
   62903,
   63387,
   63871,
   64355,
   64839,
   65323,
   65806,
   66290,
   66774,
   67258,
   67742,
   68226,
   68710,
   69194,
   69677,
   70161,
   70645,
   71129,
   71613,
   72097,
   72581,
   73065,
   73548,
   74032,
   74516,
   75000,
   75484,
   75968,
   76452
  ],
  "downbeats": [
   0,
   1935,
   3871,
   5806,
   7742,
   9677,
   11613,
   13548,
   15484,
   17419,
   19355,
   21290,
   23226,
   25161,
   27097,
   29032,
   30968,
   32903,
   34839,
   36774,
   38710,
   40645,
   42581,
   44516,
   46452,
   48387,
   50323,
   52258,
   54194,
   56129,
   58065,
   60000,
   61935,
   63871,
   65806,
   67742,
   69677,
   71613,
   73548,
   75484
  ]
 },
 "sections": [
  {
   "startMs": 0,
   "endMs": 15483,
   "label": "verse",
   "energy": 0.772
  },
  {
   "startMs": 15483,
   "endMs": 30967,
   "label": "breakdown",
   "energy": 0.597
  },
  {
   "startMs": 30967,
   "endMs": 46451,
   "label": "chorus",
   "energy": 0.729
  },
  {
   "startMs": 46451,
   "endMs": 61935,
   "label": "chorus",
   "energy": 0.782
  },
  {
   "startMs": 61935,
   "endMs": 77419,
   "label": "chorus",
   "energy": 0.791
  },
  {
   "startMs": 77419,
   "endMs": 79419,
   "label": "outro",
   "energy": 0.245
  }
 ],
 "signatureMove": {
  "startMs": 61935,
  "endMs": 69676,
  "moveId": "rocks-off-sig",
  "label": "Signature move (choreo TBD)"
 },
 "difficulties": {
  "easy": {
   "level": 2,
   "minGapMs": 948,
   "notes": [
    {
     "t": 2903,
     "dir": "left",
     "type": "tap",
     "beat": 6.0
    },
    {
     "t": 3871,
     "dir": "up",
     "type": "tap",
     "beat": 8.0
    },
    {
     "t": 4839,
     "dir": "down",
     "type": "tap",
     "beat": 10.0
    },
    {
     "t": 5806,
     "dir": "left",
     "type": "tap",
     "beat": 12.0
    },
    {
     "t": 6774,
     "dir": "right",
     "type": "tap",
     "beat": 14.0
    },
    {
     "t": 7742,
     "dir": "down",
     "type": "tap",
     "beat": 16.0
    },
    {
     "t": 8710,
     "dir": "up",
     "type": "tap",
     "beat": 18.0
    },
    {
     "t": 9677,
     "dir": "left",
     "type": "tap",
     "beat": 20.0
    },
    {
     "t": 10645,
     "dir": "right",
     "type": "tap",
     "beat": 22.0
    },
    {
     "t": 11613,
     "dir": "right",
     "type": "tap",
     "beat": 24.0
    },
    {
     "t": 12581,
     "dir": "left",
     "type": "tap",
     "beat": 26.0
    },
    {
     "t": 13548,
     "dir": "down",
     "type": "tap",
     "beat": 28.0
    },
    {
     "t": 14516,
     "dir": "up",
     "type": "tap",
     "beat": 30.0
    },
    {
     "t": 15484,
     "dir": "down",
     "type": "tap",
     "beat": 32.0
    },
    {
     "t": 16452,
     "dir": "up",
     "type": "tap",
     "beat": 34.0
    },
    {
     "t": 17419,
     "dir": "right",
     "type": "tap",
     "beat": 36.0
    },
    {
     "t": 18387,
     "dir": "left",
     "type": "tap",
     "beat": 38.0
    },
    {
     "t": 19355,
     "dir": "up",
     "type": "tap",
     "beat": 40.0
    },
    {
     "t": 20323,
     "dir": "down",
     "type": "tap",
     "beat": 42.0
    },
    {
     "t": 21290,
     "dir": "left",
     "type": "tap",
     "beat": 44.0
    },
    {
     "t": 22258,
     "dir": "right",
     "type": "tap",
     "beat": 46.0
    },
    {
     "t": 23226,
     "dir": "down",
     "type": "tap",
     "beat": 48.0
    },
    {
     "t": 24194,
     "dir": "up",
     "type": "tap",
     "beat": 50.0
    },
    {
     "t": 25161,
     "dir": "left",
     "type": "tap",
     "beat": 52.0
    },
    {
     "t": 26129,
     "dir": "right",
     "type": "tap",
     "beat": 54.0
    },
    {
     "t": 27097,
     "dir": "right",
     "type": "tap",
     "beat": 56.0
    },
    {
     "t": 28065,
     "dir": "left",
     "type": "tap",
     "beat": 58.0
    },
    {
     "t": 29032,
     "dir": "down",
     "type": "tap",
     "beat": 60.0
    },
    {
     "t": 30000,
     "dir": "up",
     "type": "tap",
     "beat": 62.0
    },
    {
     "t": 30968,
     "dir": "down",
     "type": "tap",
     "beat": 64.0
    },
    {
     "t": 31935,
     "dir": "up",
     "type": "tap",
     "beat": 66.0
    },
    {
     "t": 32903,
     "dir": "right",
     "type": "tap",
     "beat": 68.0
    },
    {
     "t": 33871,
     "dir": "left",
     "type": "tap",
     "beat": 70.0
    },
    {
     "t": 34839,
     "dir": "up",
     "type": "tap",
     "beat": 72.0
    },
    {
     "t": 35806,
     "dir": "down",
     "type": "tap",
     "beat": 74.0
    },
    {
     "t": 36774,
     "dir": "left",
     "type": "tap",
     "beat": 76.0
    },
    {
     "t": 37742,
     "dir": "right",
     "type": "tap",
     "beat": 78.0
    },
    {
     "t": 38710,
     "dir": "down",
     "type": "tap",
     "beat": 80.0
    },
    {
     "t": 39677,
     "dir": "up",
     "type": "tap",
     "beat": 82.0
    },
    {
     "t": 40645,
     "dir": "left",
     "type": "tap",
     "beat": 84.0
    },
    {
     "t": 41613,
     "dir": "right",
     "type": "tap",
     "beat": 86.0
    },
    {
     "t": 42581,
     "dir": "right",
     "type": "tap",
     "beat": 88.0
    },
    {
     "t": 43548,
     "dir": "left",
     "type": "tap",
     "beat": 90.0
    },
    {
     "t": 44516,
     "dir": "down",
     "type": "tap",
     "beat": 92.0
    },
    {
     "t": 45484,
     "dir": "up",
     "type": "tap",
     "beat": 94.0
    },
    {
     "t": 46452,
     "dir": "down",
     "type": "tap",
     "beat": 96.0
    },
    {
     "t": 47419,
     "dir": "up",
     "type": "tap",
     "beat": 98.0
    },
    {
     "t": 48387,
     "dir": "right",
     "type": "tap",
     "beat": 100.0
    },
    {
     "t": 49355,
     "dir": "left",
     "type": "tap",
     "beat": 102.0
    },
    {
     "t": 50323,
     "dir": "up",
     "type": "tap",
     "beat": 104.0
    },
    {
     "t": 51290,
     "dir": "down",
     "type": "tap",
     "beat": 106.0
    },
    {
     "t": 52258,
     "dir": "left",
     "type": "tap",
     "beat": 108.0
    },
    {
     "t": 53226,
     "dir": "right",
     "type": "tap",
     "beat": 110.0
    },
    {
     "t": 54194,
     "dir": "down",
     "type": "tap",
     "beat": 112.0
    },
    {
     "t": 55161,
     "dir": "up",
     "type": "tap",
     "beat": 114.0
    },
    {
     "t": 56129,
     "dir": "left",
     "type": "tap",
     "beat": 116.0
    },
    {
     "t": 57097,
     "dir": "right",
     "type": "tap",
     "beat": 118.0
    },
    {
     "t": 58065,
     "dir": "right",
     "type": "tap",
     "beat": 120.0
    },
    {
     "t": 59032,
     "dir": "left",
     "type": "tap",
     "beat": 122.0
    },
    {
     "t": 60000,
     "dir": "down",
     "type": "tap",
     "beat": 124.0
    },
    {
     "t": 60968,
     "dir": "up",
     "type": "tap",
     "beat": 126.0
    },
    {
     "t": 61935,
     "dir": "down",
     "type": "tap",
     "beat": 128.0,
     "sig": true
    },
    {
     "t": 62903,
     "dir": "up",
     "type": "tap",
     "beat": 130.0,
     "sig": true
    },
    {
     "t": 63871,
     "dir": "right",
     "type": "tap",
     "beat": 132.0,
     "sig": true
    },
    {
     "t": 64839,
     "dir": "left",
     "type": "tap",
     "beat": 134.0,
     "sig": true
    },
    {
     "t": 65806,
     "dir": "up",
     "type": "tap",
     "beat": 136.0,
     "sig": true
    },
    {
     "t": 66774,
     "dir": "down",
     "type": "tap",
     "beat": 138.0,
     "sig": true
    },
    {
     "t": 67742,
     "dir": "left",
     "type": "tap",
     "beat": 140.0,
     "sig": true
    },
    {
     "t": 68710,
     "dir": "right",
     "type": "tap",
     "beat": 142.0,
     "sig": true
    },
    {
     "t": 69677,
     "dir": "down",
     "type": "tap",
     "beat": 144.0
    },
    {
     "t": 70645,
     "dir": "up",
     "type": "tap",
     "beat": 146.0
    },
    {
     "t": 71613,
     "dir": "left",
     "type": "tap",
     "beat": 148.0
    },
    {
     "t": 72581,
     "dir": "right",
     "type": "tap",
     "beat": 150.0
    },
    {
     "t": 73548,
     "dir": "right",